{
  "schema_version": "active_organ_memory_run_status_receipt_v1",
  "contract_id": "C23",
  "receipt_id": "aoa-evals:active-organ-run-status:run-c-101-complete",
  "run_id": "active-organ-run:run-c-101",
  "recorded_at": "2026-07-28T21:20:00Z",
  "started_at": "2026-07-28T21:10:00Z",
  "ended_at": "2026-07-28T21:19:59Z",
  "experiment_manifest_ref": "aoa-evals:active-organ-experiment:abc-reference-v1",
  "experiment_manifest_sha256": "sha256:1111111111111111111111111111111111111111111111111111111111111111",
  "arm_id": "C",
  "seed": 101,
  "environment_pin_ref": "aoa-evals:active-organ-pin:reference-local-v1",
  "environment_pin_sha256": "sha256:3333333333333333333333333333333333333333333333333333333333333333",
  "runtime_delivery_receipt_refs": [
    "abyss-stack:C20:run-c-101-delivery"
  ],
  "run_status": "complete",
  "process_exit_code": 0,
  "execution_complete": true,
  "usable_for_comparison": true,
  "green_process": true,
  "benefit_claim_state": "not_established_by_run_status",
  "checks": {
    "executed": [
      "environment-pin-recheck",
      "corpus-digest-check",
      "planned-run-completion"
    ],
    "skipped": [],
    "blocked": []
  },
  "evidence_refs": [
    "aoa-evals:run-evidence:run-c-101"
  ],
  "output_refs": [
    "aoa-evals:run-output:run-c-101"
  ],
  "measurement_refs": [
    "aoa-stats:C10:outcome:run-c-101",
    "aoa-stats:C10:cost:run-c-101",
    "aoa-stats:C10:latency:run-c-101",
    "aoa-stats:C10:quality:run-c-101"
  ],
  "missing_evidence": [],
  "invalidation_reasons": [],
  "stop_condition_refs": [],
  "content_minimization": {
    "refs_only": true,
    "prompt_content_persisted": false,
    "memory_content_persisted": false,
    "credential_content_persisted": false,
    "private_host_capture_persisted": false
  },
  "authority": {
    "execution_status_only": true,
    "verdict_authority": false,
    "benefit_authority": false,
    "production_authority": "none",
    "policy_promotion_authority": false,
    "training_authority": false,
    "memory_semantic_authority": false
  }
}
