{
  "schema_version": "active_organ_memory_run_status_receipt_v1",
  "contract_id": "C23",
  "receipt_id": "aoa-evals:active-organ-run-status:run-b-307-blocked",
  "run_id": "active-organ-run:run-b-307",
  "recorded_at": "2026-07-28T22:00:00Z",
  "started_at": "2026-07-28T22:00:00Z",
  "ended_at": null,
  "experiment_manifest_ref": "aoa-evals:active-organ-experiment:abc-reference-v1",
  "experiment_manifest_sha256": "sha256:1111111111111111111111111111111111111111111111111111111111111111",
  "arm_id": "B",
  "seed": 307,
  "environment_pin_ref": "aoa-evals:active-organ-pin:reference-local-v1",
  "environment_pin_sha256": "sha256:3333333333333333333333333333333333333333333333333333333333333333",
  "runtime_delivery_receipt_refs": [],
  "run_status": "blocked",
  "process_exit_code": null,
  "execution_complete": false,
  "usable_for_comparison": false,
  "green_process": false,
  "benefit_claim_state": "not_established_by_run_status",
  "checks": {
    "executed": [
      "environment-pin-recheck"
    ],
    "skipped": [],
    "blocked": [
      "required C19 resource plan is not current"
    ]
  },
  "evidence_refs": [
    "aoa-evals:run-evidence:run-b-307-blocked"
  ],
  "output_refs": [],
  "measurement_refs": [],
  "missing_evidence": [
    "current host resource and storage plan"
  ],
  "invalidation_reasons": [],
  "stop_condition_refs": [
    "host-pressure"
  ],
  "content_minimization": {
    "refs_only": true,
    "prompt_content_persisted": false,
    "memory_content_persisted": false,
    "credential_content_persisted": false,
    "private_host_capture_persisted": false
  },
  "authority": {
    "execution_status_only": true,
    "verdict_authority": false,
    "benefit_authority": false,
    "production_authority": "none",
    "policy_promotion_authority": false,
    "training_authority": false,
    "memory_semantic_authority": false
  }
}
